{
  "format_version": "1.0.0",
  "run_id": "generated_b04e28aeda638f86",
  "deterministic_metrics": {
    "turn_count": 1,
    "step_count": 3,
    "tool_call_count": 1,
    "tool_result_count": 0,
    "orphan_result_count": 0,
    "tool_success_rate": 0.0,
    "missing_timestamp_rate": 0.0,
    "stitched_trace_suspect": false,
    "single_turn_fallback_used": false,
    "latency_p50": 3000.0,
    "latency_p95": 3000.0,
    "confidence_penalty_summary": {
      "no_llm_output": 1
    },
    "trusted_timestamp_count": 1,
    "untrusted_timestamp_count": 0
  },
  "rubric_results": [
    {
      "rubric_id": "TOOL_GROUNDEDNESS",
      "scope": "turn",
      "turn_id": "turn_0",
      "within_judge_results": [
        {
          "judge_id": "mock-judge-1",
          "rubric_id": "TOOL_GROUNDEDNESS",
          "turn_id": "turn_0",
          "majority_vote": null,
          "median": 3.0,
          "mean": 3.0,
          "variance": 0.0,
          "sample_size": 3,
          "scoring_type": "numeric"
        },
        {
          "judge_id": "mock-judge-2",
          "rubric_id": "TOOL_GROUNDEDNESS",
          "turn_id": "turn_0",
          "majority_vote": null,
          "median": 3.0,
          "mean": 3.0,
          "variance": 0.0,
          "sample_size": 3,
          "scoring_type": "numeric"
        }
      ],
      "cross_judge_result": {
        "weighted_vote": null,
        "weighted_average": 3.0,
        "disagreement_signal": 0.0,
        "high_risk_flag": false,
        "judge_count": 2,
        "scoring_type": "numeric",
        "mixed_types_error": null,
        "scale_warning": null
      }
    },
    {
      "rubric_id": "TOOL_CONSISTENCY",
      "scope": "turn",
      "turn_id": "turn_0",
      "within_judge_results": [
        {
          "judge_id": "mock-judge-1",
          "rubric_id": "TOOL_CONSISTENCY",
          "turn_id": "turn_0",
          "majority_vote": null,
          "median": 3.0,
          "mean": 3.0,
          "variance": 0.0,
          "sample_size": 3,
          "scoring_type": "numeric"
        },
        {
          "judge_id": "mock-judge-2",
          "rubric_id": "TOOL_CONSISTENCY",
          "turn_id": "turn_0",
          "majority_vote": null,
          "median": 3.0,
          "mean": 3.0,
          "variance": 0.0,
          "sample_size": 3,
          "scoring_type": "numeric"
        }
      ],
      "cross_judge_result": {
        "weighted_vote": null,
        "weighted_average": 3.0,
        "disagreement_signal": 0.0,
        "high_risk_flag": false,
        "judge_count": 2,
        "scoring_type": "numeric",
        "mixed_types_error": null,
        "scale_warning": null
      }
    },
    {
      "rubric_id": "TOOL_CALL_QUALITY",
      "scope": "turn",
      "turn_id": "turn_0",
      "within_judge_results": [
        {
          "judge_id": "mock-judge-1",
          "rubric_id": "TOOL_CALL_QUALITY",
          "turn_id": "turn_0",
          "majority_vote": null,
          "median": 3.0,
          "mean": 3.0,
          "variance": 0.0,
          "sample_size": 3,
          "scoring_type": "numeric"
        },
        {
          "judge_id": "mock-judge-2",
          "rubric_id": "TOOL_CALL_QUALITY",
          "turn_id": "turn_0",
          "majority_vote": null,
          "median": 3.0,
          "mean": 3.0,
          "variance": 0.0,
          "sample_size": 3,
          "scoring_type": "numeric"
        }
      ],
      "cross_judge_result": {
        "weighted_vote": null,
        "weighted_average": 3.0,
        "disagreement_signal": 0.0,
        "high_risk_flag": false,
        "judge_count": 2,
        "scoring_type": "numeric",
        "mixed_types_error": null,
        "scale_warning": null
      }
    },
    {
      "rubric_id": "TOOL_CHAINING",
      "scope": "turn",
      "turn_id": "turn_0",
      "within_judge_results": [
        {
          "judge_id": "mock-judge-1",
          "rubric_id": "TOOL_CHAINING",
          "turn_id": "turn_0",
          "majority_vote": null,
          "median": 3.0,
          "mean": 3.0,
          "variance": 0.0,
          "sample_size": 3,
          "scoring_type": "numeric"
        },
        {
          "judge_id": "mock-judge-2",
          "rubric_id": "TOOL_CHAINING",
          "turn_id": "turn_0",
          "majority_vote": null,
          "median": 3.0,
          "mean": 3.0,
          "variance": 0.0,
          "sample_size": 3,
          "scoring_type": "numeric"
        }
      ],
      "cross_judge_result": {
        "weighted_vote": null,
        "weighted_average": 3.0,
        "disagreement_signal": 0.0,
        "high_risk_flag": false,
        "judge_count": 2,
        "scoring_type": "numeric",
        "mixed_types_error": null,
        "scale_warning": null
      }
    },
    {
      "rubric_id": "TRACE_COMPLETENESS",
      "scope": "run",
      "turn_id": null,
      "within_judge_results": [
        {
          "judge_id": "mock-judge-1",
          "rubric_id": "TRACE_COMPLETENESS",
          "turn_id": null,
          "majority_vote": null,
          "median": 3.0,
          "mean": 3.0,
          "variance": 0.0,
          "sample_size": 3,
          "scoring_type": "numeric"
        },
        {
          "judge_id": "mock-judge-2",
          "rubric_id": "TRACE_COMPLETENESS",
          "turn_id": null,
          "majority_vote": null,
          "median": 3.0,
          "mean": 3.0,
          "variance": 0.0,
          "sample_size": 3,
          "scoring_type": "numeric"
        }
      ],
      "cross_judge_result": {
        "weighted_vote": null,
        "weighted_average": 3.0,
        "disagreement_signal": 0.0,
        "high_risk_flag": false,
        "judge_count": 2,
        "scoring_type": "numeric",
        "mixed_types_error": null,
        "scale_warning": null
      }
    },
    {
      "rubric_id": "SAFETY_PII",
      "scope": "run",
      "turn_id": null,
      "within_judge_results": [
        {
          "judge_id": "mock-judge-1",
          "rubric_id": "SAFETY_PII",
          "turn_id": null,
          "majority_vote": "safe",
          "median": null,
          "mean": null,
          "variance": 0.0,
          "sample_size": 3,
          "scoring_type": "categorical"
        },
        {
          "judge_id": "mock-judge-2",
          "rubric_id": "SAFETY_PII",
          "turn_id": null,
          "majority_vote": "safe",
          "median": null,
          "mean": null,
          "variance": 0.0,
          "sample_size": 3,
          "scoring_type": "categorical"
        }
      ],
      "cross_judge_result": {
        "weighted_vote": "safe",
        "weighted_average": null,
        "disagreement_signal": 0.0,
        "high_risk_flag": false,
        "judge_count": 2,
        "scoring_type": "categorical",
        "mixed_types_error": null,
        "scale_warning": null
      }
    },
    {
      "rubric_id": "accuracy",
      "scope": "turn",
      "turn_id": "turn_0",
      "within_judge_results": [
        {
          "judge_id": "mock-judge-1",
          "rubric_id": "accuracy",
          "turn_id": "turn_0",
          "majority_vote": null,
          "median": 3.0,
          "mean": 3.0,
          "variance": 0.0,
          "sample_size": 3,
          "scoring_type": "numeric"
        },
        {
          "judge_id": "mock-judge-2",
          "rubric_id": "accuracy",
          "turn_id": "turn_0",
          "majority_vote": null,
          "median": 3.0,
          "mean": 3.0,
          "variance": 0.0,
          "sample_size": 3,
          "scoring_type": "numeric"
        }
      ],
      "cross_judge_result": {
        "weighted_vote": null,
        "weighted_average": 3.0,
        "disagreement_signal": 0.0,
        "high_risk_flag": false,
        "judge_count": 2,
        "scoring_type": "numeric",
        "mixed_types_error": null,
        "scale_warning": null
      }
    }
  ],
  "judge_summary": {
    "total_jobs": 42,
    "successful_jobs": 42,
    "failed_jobs": 0,
    "parsed_job_results": 42,
    "attempted_jobs_total": 42
  }
}